{
  "$schema": "https://podeley.ar/data/rigi-proyectos.schema.json",
  "titulo": "Registro de proyectos adheridos al RIGI",
  "actualizado": "2026-08-06",
  "licencia": "CC BY 4.0",
  "nota_metodo": "Cada fila se construye leyendo la resolución que la aprueba en el Boletín Oficial, no un comunicado. El campo monto_comprometido_usd es la inversión en activos computables, que es lo que cuenta el régimen y sobre lo que corren el mínimo del artículo 172 y el plazo del 176; la inversión total del proyecto, cuando la resolución la declara aparte, va en monto_total_declarado_usd y no se suma entre filas. Lo que estima el registro lleva prefijo est_ y nunca comparte campo con lo que dice la resolución. Los agregados oficiales viven en el objeto oficial, aparte de los proyectos, porque son la cifra a reconciliar y no una fuente.",
  "nota_correcciones": "Este registro se publicó sin consultar antes a las empresas nombradas. Las correcciones que lleguen se aplican a la fila y se anotan en el arreglo correcciones, con fecha, qué cambió y quién lo señaló. Nada se edita en silencio.",
  "correcciones": [],

  "oficial": {
    "consultado": "2026-08-05",
    "url": "https://www.argentina.gob.ar/economia/rigi",
    "aprobados": 16,
    "monto_aprobado_usd": 29892000000,
    "en_evaluacion": 25,
    "monto_en_evaluacion_usd": 111037000000,
    "empleos_aprobados": 54495,
    "empleos_en_evaluacion": 142168
  },

  "campos": {
    "vpu": "Razón social del Vehículo de Proyecto Único, tal como la nombra el artículo 1 de la resolución. Suele ser una sucursal dedicada creada para el proyecto, no la empresa conocida.",
    "grupo": "Quien presenta la solicitud y controla al VPU, cuando la resolución los distingue. Se completa sólo con lo que dice la resolución: si nombra una sola entidad, queda en null aunque la prensa atribuya el proyecto a un grupo.",
    "monto_comprometido_usd": "Inversión en activos computables. Es la cifra del régimen y la que la prensa suele confundir con la inversión total.",
    "cronograma_tipo": "anual cuando la resolución abre año 1 y año 2; bienio cuando sólo da el total de los dos primeros; etapas cuando lo organiza por etapas fechadas. Las tres formas existen en el corpus y ninguna se convierte a las otras.",
    "plazo_minimo": "Fecha límite comprometida para alcanzar el monto mínimo de inversión, artículo 176. Cuando la resolución sólo declara el mes, la fecha va con precisión de mes.",
    "proveedores_locales_pct": "Porcentaje del monto de inversión comprometido con proveedores locales, artículo 47 inciso l del anexo del decreto 749/2024. El piso normativo es 20%.",
    "confianza": "Califica la procedencia de las cifras, no el mérito del proyecto.",
    "est_cumplimiento": "Estimación propia. sin-dato significa que no hay evidencia pública de ejecución; no significa atraso."
  },

  "proyectos": [
    {
      "id": "luz-del-campo-el-quemado",
      "vpu": "Luz del Campo SA",
      "cuit": "30-71765521-0",
      "grupo": null,
      "proyecto": "Parque Solar El Quemado y Anexos",
      "sector": "Energía",
      "subsector": null,
      "provincias": ["Mendoza"],
      "capacidad": "305 MW de capacidad instalada",
      "estado": "aprobado",
      "confianza": "alta",
      "resolucion": "Resolución 1/2025 del Ministerio de Economía",
      "publicacion_fecha": "2025-01-08",
      "boletin_url": "https://www.boletinoficial.gob.ar/detalleAviso/primera/319374/20250108",
      "expediente": "EX-2024-117037596",
      "acta_comite": 3,
      "monto_comprometido_usd": 211600072,
      "monto_total_declarado_usd": null,
      "cronograma_tipo": "bienio",
      "cronograma": [{ "periodo": "años 1 y 2", "monto_usd": 204544000 }],
      "plazo_minimo": "2027-01-30",
      "proveedores_locales_pct": null,
      "proveedores_locales_usd": 117523278,
      "beneficios": ["cap-iv", "cap-v"],
      "exportacion_estrategica": false,
      "ampliacion": false,
      "est_cumplimiento": "sin-dato",
      "nota": "Primera adhesión aprobada del régimen. La resolución no abre el cronograma por año: declara el total de los dos primeros y lo contrasta contra el 40% del mínimo del sector.",
      "fuentes": ["https://www.boletinoficial.gob.ar/detalleAviso/primera/319374/20250108"]
    },
    {
      "id": "vmos-oleoducto-sur",
      "vpu": "VMOS S.A.",
      "cuit": "30-71871335-4",
      "grupo": null,
      "proyecto": "Vaca Muerta Oleoducto Sur",
      "sector": "Petróleo y Gas",
      "subsector": null,
      "provincias": ["Río Negro"],
      "capacidad": "377,400 barriles/día de capacidad base; 437 km de traza entre Allen y Punta Colorada",
      "estado": "aprobado",
      "confianza": "alta",
      "resolucion": "Resolución 302/2025 del Ministerio de Economía",
      "publicacion_fecha": "2025-03-21",
      "boletin_url": "https://www.boletinoficial.gob.ar/detalleAviso/primera/322830/20250321",
      "expediente": "EX-2024-126061655",
      "acta_comite": null,
      "monto_comprometido_usd": 2486000000,
      "monto_total_declarado_usd": 3000000000,
      "cronograma_tipo": "anual",
      "cronograma": [
        { "periodo": "año 1", "monto_usd": 1318000000 },
        { "periodo": "año 2", "monto_usd": 1123000000 }
      ],
      "plazo_minimo": "2028-12-31",
      "proveedores_locales_pct": null,
      "proveedores_locales_usd": null,
      "beneficios": ["cap-iv", "cap-v"],
      "exportacion_estrategica": true,
      "ampliacion": false,
      "est_cumplimiento": "sin-dato",
      "nota": "El caso que separa las dos cifras: la inversión total declarada son USD 3,000 M y los activos computables USD 2,486 M. La cifra que circula en prensa es la segunda, presentada como si fuera la primera.",
      "fuentes": ["https://www.boletinoficial.gob.ar/detalleAviso/primera/322830/20250321"]
    },
    {
      "id": "southern-energy-gnl",
      "vpu": "Southern Energy S.A.",
      "cuit": "30-71858062-1",
      "grupo": null,
      "proyecto": "Proyecto de Licuefacción de Gas Natural",
      "sector": "Petróleo y Gas",
      "subsector": null,
      "provincias": ["Río Negro"],
      "capacidad": "GNL, con producción declarada a partir de 1.5 millones de toneladas anuales",
      "estado": "aprobado",
      "confianza": "alta",
      "resolucion": "Resolución 559/2025 del Ministerio de Economía",
      "publicacion_fecha": "2025-05-05",
      "boletin_url": "https://www.boletinoficial.gob.ar/detalleAviso/primera/324772/20250505",
      "expediente": null,
      "acta_comite": 5,
      "monto_comprometido_usd": 2825000000,
      "monto_total_declarado_usd": null,
      "cronograma_tipo": "anual",
      "cronograma": [
        { "periodo": "año 1", "monto_usd": 105000000 },
        { "periodo": "año 2", "monto_usd": 354000000 }
      ],
      "plazo_minimo": "2035-12-31",
      "proveedores_locales_pct": null,
      "proveedores_locales_usd": null,
      "beneficios": ["cap-iv", "cap-v"],
      "exportacion_estrategica": true,
      "ampliacion": false,
      "est_cumplimiento": "sin-dato",
      "nota": "El plazo más largo del registro: diez años más que la mediana. Los dos primeros años comprometen USD 459 M sobre USD 2,825 M, el perfil más diferido de los veintiuno.",
      "fuentes": ["https://www.boletinoficial.gob.ar/detalleAviso/primera/324772/20250505"]
    },
    {
      "id": "rincon-mining",
      "vpu": "Rincón Mining PTY LTD. Sucursal Argentina",
      "cuit": "30-70708643-9",
      "grupo": null,
      "proyecto": "Proyecto Rincón",
      "sector": "Minería",
      "subsector": "Potasio y litio",
      "provincias": ["Salta"],
      "capacidad": null,
      "estado": "aprobado",
      "confianza": "alta",
      "resolucion": "Resolución 735/2025 del Ministerio de Economía",
      "publicacion_fecha": "2025-06-03",
      "boletin_url": "https://www.boletinoficial.gob.ar/detalleAviso/primera/326364/20250603",
      "expediente": "EX-2025-20445333",
      "acta_comite": 6,
      "monto_comprometido_usd": 2299000000,
      "monto_total_declarado_usd": 2744000000,
      "cronograma_tipo": "anual",
      "cronograma": [
        { "periodo": "año 1", "monto_usd": 516963963 },
        { "periodo": "año 2", "monto_usd": 776547631 }
      ],
      "plazo_minimo": "2029-06-30",
      "proveedores_locales_pct": null,
      "proveedores_locales_usd": null,
      "beneficios": ["cap-iv", "cap-v"],
      "exportacion_estrategica": true,
      "ampliacion": false,
      "est_cumplimiento": "sin-dato",
      "nota": null,
      "fuentes": ["https://www.boletinoficial.gob.ar/detalleAviso/primera/326364/20250603"]
    },
    {
      "id": "sidersa-aceria",
      "vpu": "Sidersa Acería S.D.E.",
      "cuit": "33-71879284-9",
      "grupo": "Sidersa S.A.",
      "grupo_cuit": "30-61536829-2",
      "proyecto": "Proyecto Siderúrgico Argentino Sidersa",
      "sector": "Siderurgia",
      "subsector": null,
      "provincias": ["Buenos Aires"],
      "capacidad": "360,000 toneladas por año de aceros largos; planta en San Nicolás de los Arroyos",
      "estado": "aprobado",
      "confianza": "alta",
      "resolucion": "Resolución 1028/2025 del Ministerio de Economía",
      "publicacion_fecha": "2025-07-22",
      "boletin_url": "https://www.boletinoficial.gob.ar/detalleAviso/primera/328690/20250722",
      "expediente": "EX-2024-136346034",
      "acta_comite": 7,
      "monto_comprometido_usd": 286278000,
      "monto_total_declarado_usd": null,
      "cronograma_tipo": "anual",
      "cronograma": [
        { "periodo": "año 1", "monto_usd": 142874000 },
        { "periodo": "año 2", "monto_usd": 127334000 }
      ],
      "plazo_minimo": "2026-10-31",
      "proveedores_locales_pct": null,
      "proveedores_locales_usd": null,
      "beneficios": ["cap-iv", "cap-v", "art-190"],
      "exportacion_estrategica": false,
      "ampliacion": false,
      "est_cumplimiento": "sin-dato",
      "nota": "El plazo más próximo del registro: vence el 31 de octubre de 2026. Único proyecto del sector siderurgia.",